{
  "server": {
    "port": 13579,
    "host": "0.0.0.0"
  },
  "connectors": {
    "default": "iflow",
    "timeout": 120000
  },
  "plugins": {
    "enabled": [
      "config-manager",
      "context-memory",
      "mcp-browser",
      "notification"
    ],
    "config": {}
  },
  "tasks": {
    "concurrent": 3,
    "retryTimes": 3,
    "timeout": 300000
  },
  "tools": [],
  "memory": {
    "maxSize": 1000,
    "defaultTTL": 604800000
  }
}
